State Property Mens Peng Caps (Turquoise/Purple);http://www.yukka.co.uk/men/mens-clothing/hats-caps/state-property-mens-peng-caps-turquoise-purple.html
State Property Mens Nerd Caps (Black/Red);http://www.yukka.co.uk/men/mens-clothing/hats-caps/state-property-mens-nerd-caps-black-red.html
Crooks & Castles Caps Thuxury Serif Logo Black;http://www.yukka.co.uk/men/mens-clothing/hats-caps/crooks-castles-mens-caps-thuxury-serif-logo-black.html
Crooks & Castle Caps Thuxury Greco Logo Burgundy;http://www.yukka.co.uk/men/mens-clothing/hats-caps/crooks-castles-mens-caps-thuxury-greco-logo-burgundy.html
Crooks & Castles Thuxury Greco Logo Adjustable Cap (Black);http://www.yukka.co.uk/men/mens-clothing/hats-caps/crooks-castles-mens-caps-thuxury-greco-logo-black.html
Crooks & Castles Thuxury Crooks Adjustable Cap (Black);http://www.yukka.co.uk/men/mens-clothing/hats-caps/crooks-castles-caps-black-thuxury-crooks.html
Crooks & Castles Greco Logo Cap (Black);http://www.yukka.co.uk/men/mens-clothing/hats-caps/crooks-castles-caps-greco-logo-black.html
Supra Mens Era Caps (Black);http://www.yukka.co.uk/men/mens-clothing/hats-caps/supra-mens-era-caps-black.html
Mishka Mens Oversize Adder Caps (Black);http://www.yukka.co.uk/men/mens-clothing/hats-caps/mishka-mens-oversize-adder-caps-black-1.html
State Property Whats Up Doc Snapback (Grey/White);http://www.yukka.co.uk/men/mens-clothing/hats-caps/state-property-mens-whats-up-doc-caps-grey-white.html
State Property Whats Up Doc Snapback (Blue/Grey);http://www.yukka.co.uk/men/mens-clothing/hats-caps/state-property-mens-whats-up-doc-caps-blue-grey.html
State Property Whats Up Doc Snapback (Pink/Blue);http://www.yukka.co.uk/men/mens-clothing/hats-caps/state-property-mens-whats-up-doc-caps-pink-blue.html
State Property Whats Up Doc Snapback (Blue/Red);http://www.yukka.co.uk/men/mens-clothing/hats-caps/state-property-mens-whats-up-doc-caps-blue-red.html
State Property Whats Up Doc Snapback (Black/White);http://www.yukka.co.uk/men/mens-clothing/hats-caps/state-property-mens-whats-up-doc-caps-black-white.html
State Property Whats Up Doc Snapback (Black/Pink);http://www.yukka.co.uk/men/mens-clothing/hats-caps/state-property-mens-whats-up-doc-caps-black-pink.html
State Property DWBH Snapback (Turquoise);http://www.yukka.co.uk/men/mens-clothing/hats-caps/state-property-mens-dwbh-caps-turquoise.html
State Property DWBH Snapback (Pink/White);http://www.yukka.co.uk/men/mens-clothing/hats-caps/state-property-mens-dwbh-caps-pink-white.html
State Property DWBH Snapback (Grey/Purple);http://www.yukka.co.uk/men/mens-clothing/hats-caps/state-property-mens-dwbh-caps-grey-purple.html
State Property DWBH Snapback (Green/White);http://www.yukka.co.uk/men/mens-clothing/hats-caps/state-property-mens-dwbh-caps-green-white.html
State Property DWBH Snapback (Green/Black);http://www.yukka.co.uk/men/mens-clothing/hats-caps/state-property-mens-dwbh-caps-green-black.html
State Property DWBH Snapback (Black);http://www.yukka.co.uk/men/mens-clothing/hats-caps/state-property-mens-dwbh-caps-black-black.html
State Property DWBH Snapback (Black/Purple);http://www.yukka.co.uk/men/mens-clothing/hats-caps/state-property-mens-dwbh-caps-black-purple.html
State Property DWBH Snapback (Black/Pink);http://www.yukka.co.uk/men/mens-clothing/hats-caps/state-property-mens-dwbh-caps-black-pink.html
State Property Peng Snapback (Black/Pink/Camo);http://www.yukka.co.uk/men/mens-clothing/hats-caps/state-property-mens-peng-caps-black-pink-camo.html
State Property LOL Snapback (Pink/Cheetah);http://www.yukka.co.uk/men/mens-clothing/hats-caps/state-property-mens-lol-caps-pink-cheetah.html
State Property LOL Snapback (Purple/Cheetah);http://www.yukka.co.uk/men/mens-clothing/hats-caps/state-property-mens-lol-caps-purple-cheetah.html
State Property LOL Snapback (Pink/Cheetah/Black);http://www.yukka.co.uk/men/mens-clothing/hats-caps/state-property-mens-lol-caps-pink-cheetah-black.html
State Property LOL Snapback (Brown/Cheetah);http://www.yukka.co.uk/men/mens-clothing/hats-caps/state-property-mens-lol-caps-brown-cheetah.html
State Property Side Badge Snapback (Turquoise/White);http://www.yukka.co.uk/men/mens-clothing/hats-caps/state-property-mens-side-badge-caps-turquoise-white.html
State Property Side Badge Snapback (Grey/White);http://www.yukka.co.uk/men/mens-clothing/hats-caps/state-property-mens-side-badge-caps-grey-white.html
State Property Side Badge Snapback (Grey/Black);http://www.yukka.co.uk/men/mens-clothing/hats-caps/state-property-mens-side-badge-caps-grey-black.html
State Property Side Badge Snapback (Black/White);http://www.yukka.co.uk/men/mens-clothing/hats-caps/state-property-mens-side-badge-caps-black-white.html
